<?xml version="1.0" encoding="UTF-8"?>
<!-- Version: $Id: fields.xml,v 1.32 2008/11/04 22:43:27 tdanard Exp $ -->
<fields xmlns:xsi="http://www.w3.org/2001/XMLSchema-instance"
	xsi:noNamespaceSchemaLocation="../../schemas/fields.xsd">
	<field display-entry-size="20" display-search-size="20"
		enabled-flag="Y" entity-id="CORE-ENTY-8" id="CORE-FILD-1"
		indexed-flag="N" max-entry-size="100" max-search-size="100"
		type="VARCHAR">
		<contextual-name>Language</contextual-name>
		<full-name>Language</full-name>
		<xml-contextual-name>language</xml-contextual-name>
		<xml-full-name>language</xml-full-name>
		<vcard-name />
		<preferred-name />
		<description>
			Customization of this site based upon your geographical or
			cultural region
		</description>
		<comment />
		<access-key />
	</field>
	<field display-entry-size="20" display-search-size="20"
		enabled-flag="Y" entity-id="CORE-ENTY-2" id="CORE-FILD-15"
		indexed-flag="N" max-entry-size="255" max-search-size="255"
		type="VARCHAR">
		<contextual-name>Login</contextual-name>
		<full-name>User Account Login</full-name>
		<xml-contextual-name>login</xml-contextual-name>
		<xml-full-name>account-login</xml-full-name>
		<vcard-name />
		<preferred-name />
		<description>
			Unique identifier of a user account for this site
		</description>
		<comment />
		<access-key />
	</field>
	<field display-entry-size="20" display-search-size="20"
		enabled-flag="Y" entity-id="CORE-ENTY-2" id="CORE-FILD-16"
		indexed-flag="N" max-entry-size="20" max-search-size="20"
		type="VARCHAR">
		<contextual-name>Password</contextual-name>
		<full-name>User Account Password</full-name>
		<xml-contextual-name>password</xml-contextual-name>
		<xml-full-name>account-password</xml-full-name>
		<vcard-name />
		<preferred-name />
		<description>
			Secret sequence of characters required for access to this
			site
		</description>
		<comment>
			A password is personal, and must be at least 6 characters
			long to be valid
		</comment>
		<access-key />
	</field>
	<field display-entry-size="20" display-search-size="20"
		enabled-flag="Y" entity-id="CORE-ENTY-2" id="CORE-FILD-17"
		indexed-flag="N" max-entry-size="20" max-search-size="20"
		type="VARCHAR">
		<contextual-name>Enable auto log in</contextual-name>
		<full-name>User Account Enable auto log in</full-name>
		<xml-contextual-name>auto-sign-in</xml-contextual-name>
		<xml-full-name>account-auto-sign-in</xml-full-name>
		<vcard-name />
		<preferred-name />
		<description>
			Automatically signs you in next time you connect to this
			server
		</description>
		<comment>
			This option should be used only if you are not using a
			public computer
		</comment>
		<access-key />
	</field>
	<field display-entry-size="20" display-search-size="20"
		enabled-flag="Y" entity-id="CORE-ENTY-2" id="CORE-FILD-18"
		indexed-flag="N" max-entry-size="20" max-search-size="20"
		type="VARCHAR">
		<contextual-name>Old Password</contextual-name>
		<full-name>Old User Account Password</full-name>
		<xml-contextual-name>old-password</xml-contextual-name>
		<xml-full-name>account-old-password</xml-full-name>
		<vcard-name />
		<preferred-name />
		<description>
			Current secret sequence of characters required for access to
			this site
		</description>
		<comment>
			A password is personal, and must be at least 6 characters
			long to be valid
		</comment>
		<access-key />
	</field>
	<field display-entry-size="20" display-search-size="20"
		enabled-flag="Y" entity-id="CORE-ENTY-2" id="CORE-FILD-19"
		indexed-flag="N" max-entry-size="20" max-search-size="20"
		type="VARCHAR">
		<contextual-name>New Password</contextual-name>
		<full-name>New User Account Password</full-name>
		<xml-contextual-name>new-password</xml-contextual-name>
		<xml-full-name>account-new-password</xml-full-name>
		<vcard-name />
		<preferred-name />
		<description>
			New secret sequence of characters required for access to
			this site
		</description>
		<comment>
			A password is personal, and must be at least 6 characters
			long to be valid
		</comment>
		<access-key />
	</field>
	<field display-entry-size="20" display-search-size="20"
		enabled-flag="Y" entity-id="CORE-ENTY-8" id="CORE-FILD-2"
		indexed-flag="N" max-entry-size="100" max-search-size="100"
		type="VARCHAR">
		<contextual-name />
		<full-name />
		<xml-contextual-name>empty</xml-contextual-name>
		<xml-full-name>empty</xml-full-name>
		<vcard-name />
		<preferred-name />
		<description />
		<comment />
		<access-key />
	</field>
	<field display-entry-size="20" display-search-size="20"
		enabled-flag="Y" entity-id="CORE-ENTY-2" id="CORE-FILD-20"
		indexed-flag="N" max-entry-size="20" max-search-size="20"
		type="VARCHAR">
		<contextual-name>Repeat New Password</contextual-name>
		<full-name>Repeat New User Account Password</full-name>
		<xml-contextual-name>new-password</xml-contextual-name>
		<xml-full-name>account-new-password</xml-full-name>
		<vcard-name />
		<preferred-name />
		<description>
			New secret sequence of characters required for access to
			this site
		</description>
		<comment />
		<access-key />
	</field>
	<field display-entry-size="30" display-search-size="30"
		enabled-flag="Y" entity-id="CORE-ENTY-2" id="CORE-FILD-21"
		indexed-flag="N" max-entry-size="30" max-search-size="30"
		type="VARCHAR">
		<contextual-name>First Name</contextual-name>
		<full-name>User Account First Name</full-name>
		<xml-contextual-name>first-name</xml-contextual-name>
		<xml-full-name>account-first-name</xml-full-name>
		<vcard-name />
		<preferred-name />
		<description>
			The name that stands first in a full name
		</description>
		<comment />
		<access-key />
	</field>
	<field display-entry-size="0" display-search-size="0"
		enabled-flag="Y" entity-id="CORE-ENTY-8" id="CORE-FILD-213"
		indexed-flag="N" max-entry-size="0" max-search-size="0"
		type="VARCHAR">
		<contextual-name>Name</contextual-name>
		<full-name>Match Name</full-name>
		<xml-contextual-name>name</xml-contextual-name>
		<xml-full-name>match-name</xml-full-name>
		<vcard-name />
		<preferred-name />
		<description>Name of the match</description>
		<comment />
		<access-key />
	</field>
	<field display-entry-size="0" display-search-size="0"
		enabled-flag="Y" entity-id="CORE-ENTY-8" id="CORE-FILD-214"
		indexed-flag="N" max-entry-size="0" max-search-size="0"
		type="VARCHAR">
		<contextual-name>Description</contextual-name>
		<full-name>Match Description</full-name>
		<xml-contextual-name>description</xml-contextual-name>
		<xml-full-name>match-description</xml-full-name>
		<vcard-name />
		<preferred-name />
		<description>
			Detailed description or preview of the match
		</description>
		<comment />
		<access-key />
	</field>
	<field display-entry-size="0" display-search-size="0"
		enabled-flag="Y" entity-id="CORE-ENTY-4" id="CORE-FILD-219"
		indexed-flag="N" max-entry-size="0" max-search-size="0"
		type="VARCHAR">
		<contextual-name>Name</contextual-name>
		<full-name>Term Name</full-name>
		<xml-contextual-name>name</xml-contextual-name>
		<xml-full-name>term-name</xml-full-name>
		<vcard-name />
		<preferred-name />
		<description>Word or expression used</description>
		<comment />
		<access-key />
	</field>
	<field display-entry-size="30" display-search-size="30"
		enabled-flag="Y" entity-id="CORE-ENTY-2" id="CORE-FILD-22"
		indexed-flag="N" max-entry-size="30" max-search-size="30"
		type="VARCHAR">
		<contextual-name>Last Name</contextual-name>
		<full-name>User Account Last Name</full-name>
		<xml-contextual-name>last-name</xml-contextual-name>
		<xml-full-name>account-last-name</xml-full-name>
		<vcard-name />
		<preferred-name />
		<description>
			The name that stands last in a full name
		</description>
		<comment>The last name is also called surname</comment>
		<access-key />
	</field>
	<field display-entry-size="0" display-search-size="0"
		enabled-flag="Y" entity-id="CORE-ENTY-4" id="CORE-FILD-220"
		indexed-flag="N" max-entry-size="0" max-search-size="0"
		type="VARCHAR">
		<contextual-name>Description</contextual-name>
		<full-name>Term Description</full-name>
		<xml-contextual-name>description</xml-contextual-name>
		<xml-full-name>term-description</xml-full-name>
		<vcard-name />
		<preferred-name />
		<description>
			Detailed explanation of a word or expression
		</description>
		<comment />
		<access-key />
	</field>
	<field display-entry-size="0" display-search-size="0"
		enabled-flag="Y" entity-id="CORE-ENTY-6" id="CORE-FILD-226"
		indexed-flag="N" max-entry-size="0" max-search-size="0"
		type="VARCHAR">
		<contextual-name>Name</contextual-name>
		<full-name>Screen Name</full-name>
		<xml-contextual-name>name</xml-contextual-name>
		<xml-full-name>screen-name</xml-full-name>
		<vcard-name />
		<preferred-name />
		<description>
			Name of the screen, as displayed in the header
		</description>
		<comment />
		<access-key />
	</field>
	<field display-entry-size="0" display-search-size="0"
		enabled-flag="Y" entity-id="CORE-ENTY-6" id="CORE-FILD-227"
		indexed-flag="N" max-entry-size="0" max-search-size="0"
		type="VARCHAR">
		<contextual-name>Description</contextual-name>
		<full-name>Screen Description</full-name>
		<xml-contextual-name>description</xml-contextual-name>
		<xml-full-name>screen-description</xml-full-name>
		<vcard-name />
		<preferred-name />
		<description>
			Detailed explanation of the function of the screen
		</description>
		<comment />
		<access-key />
	</field>
	<field display-entry-size="30" display-search-size="30"
		enabled-flag="Y" entity-id="CORE-ENTY-2" id="CORE-FILD-23"
		indexed-flag="N" max-entry-size="100" max-search-size="100"
		type="VARCHAR">
		<contextual-name>Email Address</contextual-name>
		<full-name>User Account Email Address</full-name>
		<xml-contextual-name>email-address</xml-contextual-name>
		<xml-full-name>account-email-address</xml-full-name>
		<vcard-name />
		<preferred-name />
		<description>
			Mailbox used to send and receive electronic messages
		</description>